### ISSUE TITLE
changing write_riemann default settings 

### ISSUE THREAD

**Issue by mfournier** [collectd/collectd#891]
I'd like to discuss moving to the following default settings:
 - `Protocol TCP`: improves reliability, using UDP is discouraged by riemann's author.
 - `Batch true`: significantly lowers the workload for the riemann server. write_graphite and network plugins already do the equivalent by default.
 - `TTLFactor 4.0`. when batching is enabled, current default (2.0) has the following issue: when an event is kept back in collectd waiting for the next batch to fill up, it happens that riemann receives it just a few milliseconds after the previous event expiration time, leading to the event expiration handling to kick in needlessly (https://gist.github.com/mfournier/c52a77a18c6636752551 shows the sequence of operations). Wondering if this wouldn't warrant a dedicated bugreport & fix though (ie: write_riemann should flush events at least N milliseconds before they expire).

@pyr, @udoprog, @faxm0dem, @blalor, would love to have your opinion !

**Comment by blalor** [comment]
Just looking at @pyr's change that adds batching; I see that notifications are sent immediately, regardless of the `Batch` setting, which was my first concern (even though I don't currently use notifications in collectd).  Why does batching of metrics lower the workload on the Riemann server?  It appears that the connection is kept open when using TCP, which is where I'd think the most overhead would be.

**Comment by mfournier** [comment]
@blalor, here's 30s worth of collectd <-> riemann traffic with batching:
```
10:39:31.900466 IP collectd.51426 > riemann.5555: Flags [.], seq 2186975008:2186976364, ack 3480349654, win 229, options [nop,nop,TS val 320196336 ecr 1751866440], length 1356
10:39:31.900480 IP collectd.51426 > riemann.5555: Flags [.], seq 1356:2712, ack 1, win 229, options [nop,nop,TS val 320196336 ecr 1751866440], length 1356
10:39:31.900502 IP collectd.51426 > riemann.5555: Flags [.], seq 2712:4068, ack 1, win 229, options [nop,nop,TS val 320196336 ecr 1751866440], length 1356
10:39:31.900506 IP collectd.51426 > riemann.5555: Flags [.], seq 4068:5424, ack 1, win 229, options [nop,nop,TS val 320196336 ecr 1751866440], length 1356
10:39:31.900528 IP collectd.51426 > riemann.5555: Flags [.], seq 5424:6780, ack 1, win 229, options [nop,nop,TS val 320196336 ecr 1751866440], length 1356
10:39:31.900532 IP collectd.51426 > riemann.5555: Flags [.], seq 6780:8136, ack 1, win 229, options [nop,nop,TS val 320196336 ecr 1751866440], length 1356
10:39:31.900545 IP collectd.51426 > riemann.5555: Flags [P.], seq 8136:8325, ack 1, win 229, options [nop,nop,TS val 320196336 ecr 1751866440], length 189
10:39:31.923264 IP riemann.5555 > collectd.51426: Flags [.], ack 2712, win 1452, options [nop,nop,TS val 1751868931 ecr 320196336], length 0
10:39:31.923994 IP riemann.5555 > collectd.51426: Flags [.], ack 5424, win 1452, options [nop,nop,TS val 1751868931 ecr 320196336], length 0
10:39:31.924052 IP riemann.5555 > collectd.51426: Flags [.], ack 8136, win 1452, options [nop,nop,TS val 1751868931 ecr 320196336], length 0
10:39:31.927019 IP riemann.5555 > collectd.51426: Flags [P.], seq 1:7, ack 8325, win 1452, options [nop,nop,TS val 1751868932 ecr 320196336], length 6
10:39:31.927090 IP collectd.51426 > riemann.5555: Flags [.], ack 7, win 229, options [nop,nop,TS val 320196342 ecr 1751868932], length 0
10:39:31.928074 IP collectd.51426 > riemann.5555: Flags [.], seq 8325:9681, ack 7, win 229, options [nop,nop,TS val 320196343 ecr 1751868932], length 1356
10:39:31.928082 IP collectd.51426 > riemann.5555: Flags [.], seq 9681:11037, ack 7, win 229, options [nop,nop,TS val 320196343 ecr 1751868932], length 1356
10:39:31.928104 IP collectd.51426 > riemann.5555: Flags [.], seq 11037:12393, ack 7, win 229, options [nop,nop,TS val 320196343 ecr 1751868932], length 1356
10:39:31.928109 IP collectd.51426 > riemann.5555: Flags [.], seq 12393:13749, ack 7, win 229, options [nop,nop,TS val 320196343 ecr 1751868932], length 1356
10:39:31.928135 IP collectd.51426 > riemann.5555: Flags [.], seq 13749:15105, ack 7, win 229, options [nop,nop,TS val 320196343 ecr 1751868932], length 1356
10:39:31.928140 IP collectd.51426 > riemann.5555: Flags [.], seq 15105:16461, ack 7, win 229, options [nop,nop,TS val 320196343 ecr 1751868932], length 1356
10:39:31.928156 IP collectd.51426 > riemann.5555: Flags [P.], seq 16461:16621, ack 7, win 229, options [nop,nop,TS val 320196343 ecr 1751868932], length 160
10:39:31.949901 IP riemann.5555 > collectd.51426: Flags [.], ack 12393, win 1452, options [nop,nop,TS val 1751868938 ecr 320196343], length 0
10:39:31.954610 IP riemann.5555 > collectd.51426: Flags [.], ack 16621, win 1452, options [nop,nop,TS val 1751868939 ecr 320196343], length 0
10:39:31.957993 IP riemann.5555 > collectd.51426: Flags [P.], seq 7:13, ack 16621, win 1452, options [nop,nop,TS val 1751868940 ecr 320196343], length 6
10:39:31.958682 IP collectd.51426 > riemann.5555: Flags [.], seq 16621:17977, ack 13, win 229, options [nop,nop,TS val 320196350 ecr 1751868940], length 1356
10:39:31.958689 IP collectd.51426 > riemann.5555: Flags [.], seq 17977:19333, ack 13, win 229, options [nop,nop,TS val 320196350 ecr 1751868940], length 1356
10:39:31.958706 IP collectd.51426 > riemann.5555: Flags [.], seq 19333:20689, ack 13, win 229, options [nop,nop,TS val 320196350 ecr 1751868940], length 1356
10:39:31.958711 IP collectd.51426 > riemann.5555: Flags [.], seq 20689:22045, ack 13, win 229, options [nop,nop,TS val 320196350 ecr 1751868940], length 1356
10:39:31.958727 IP collectd.51426 > riemann.5555: Flags [.], seq 22045:23401, ack 13, win 229, options [nop,nop,TS val 320196350 ecr 1751868940], length 1356
10:39:31.958730 IP collectd.51426 > riemann.5555: Flags [.], seq 23401:24757, ack 13, win 229, options [nop,nop,TS val 320196350 ecr 1751868940], length 1356
10:39:31.958742 IP collectd.51426 > riemann.5555: Flags [P.], seq 24757:24893, ack 13, win 229, options [nop,nop,TS val 320196350 ecr 1751868940], length 136
10:39:31.981832 IP riemann.5555 > collectd.51426: Flags [.], ack 19333, win 1452, options [nop,nop,TS val 1751868945 ecr 320196350], length 0
10:39:31.981903 IP riemann.5555 > collectd.51426: Flags [.], ack 22045, win 1452, options [nop,nop,TS val 1751868946 ecr 320196350], length 0
10:39:31.982003 IP riemann.5555 > collectd.51426: Flags [.], ack 24757, win 1452, options [nop,nop,TS val 1751868946 ecr 320196350], length 0
10:39:31.985021 IP riemann.5555 > collectd.51426: Flags [P.], seq 13:19, ack 24893, win 1452, options [nop,nop,TS val 1751868946 ecr 320196350], length 6
10:39:32.023289 IP collectd.51426 > riemann.5555: Flags [.], ack 19, win 229, options [nop,nop,TS val 320196367 ecr 1751868946], length 0
10:39:41.900811 IP collectd.51426 > riemann.5555: Flags [.], seq 24893:26249, ack 19, win 229, options [nop,nop,TS val 320198836 ecr 1751868946], length 1356
10:39:41.900826 IP collectd.51426 > riemann.5555: Flags [.], seq 26249:27605, ack 19, win 229, options [nop,nop,TS val 320198836 ecr 1751868946], length 1356
10:39:41.900848 IP collectd.51426 > riemann.5555: Flags [.], seq 27605:28961, ack 19, win 229, options [nop,nop,TS val 320198836 ecr 1751868946], length 1356
10:39:41.900853 IP collectd.51426 > riemann.5555: Flags [.], seq 28961:30317, ack 19, win 229, options [nop,nop,TS val 320198836 ecr 1751868946], length 1356
10:39:41.900869 IP collectd.51426 > riemann.5555: Flags [.], seq 30317:31673, ack 19, win 229, options [nop,nop,TS val 320198836 ecr 1751868946], length 1356
10:39:41.900871 IP collectd.51426 > riemann.5555: Flags [.], seq 31673:33029, ack 19, win 229, options [nop,nop,TS val 320198836 ecr 1751868946], length 1356
10:39:41.900884 IP collectd.51426 > riemann.5555: Flags [P.], seq 33029:33194, ack 19, win 229, options [nop,nop,TS val 320198836 ecr 1751868946], length 165
10:39:41.925157 IP riemann.5555 > collectd.51426: Flags [.], ack 27605, win 1452, options [nop,nop,TS val 1751871431 ecr 320198836], length 0
10:39:41.925932 IP riemann.5555 > collectd.51426: Flags [.], ack 33194, win 1452, options [nop,nop,TS val 1751871432 ecr 320198836], length 0
10:39:41.928809 IP riemann.5555 > collectd.51426: Flags [P.], seq 19:25, ack 33194, win 1452, options [nop,nop,TS val 1751871432 ecr 320198836], length 6
10:39:41.928890 IP collectd.51426 > riemann.5555: Flags [.], ack 25, win 229, options [nop,nop,TS val 320198843 ecr 1751871432], length 0
10:39:41.929963 IP collectd.51426 > riemann.5555: Flags [.], seq 33194:34550, ack 25, win 229, options [nop,nop,TS val 320198843 ecr 1751871432], length 1356
10:39:41.929979 IP collectd.51426 > riemann.5555: Flags [.], seq 34550:35906, ack 25, win 229, options [nop,nop,TS val 320198843 ecr 1751871432], length 1356
10:39:41.930006 IP collectd.51426 > riemann.5555: Flags [.], seq 35906:37262, ack 25, win 229, options [nop,nop,TS val 320198843 ecr 1751871432], length 1356
10:39:41.930010 IP collectd.51426 > riemann.5555: Flags [.], seq 37262:38618, ack 25, win 229, options [nop,nop,TS val 320198843 ecr 1751871432], length 1356
10:39:41.930030 IP collectd.51426 > riemann.5555: Flags [.], seq 38618:39974, ack 25, win 229, options [nop,nop,TS val 320198843 ecr 1751871432], length 1356
10:39:41.930034 IP collectd.51426 > riemann.5555: Flags [.], seq 39974:41330, ack 25, win 229, options [nop,nop,TS val 320198843 ecr 1751871432], length 1356
10:39:41.930049 IP collectd.51426 > riemann.5555: Flags [P.], seq 41330:41494, ack 25, win 229, options [nop,nop,TS val 320198843 ecr 1751871432], length 164
10:39:41.951171 IP riemann.5555 > collectd.51426: Flags [.], ack 35906, win 1452, options [nop,nop,TS val 1751871438 ecr 320198843], length 0
10:39:41.951730 IP riemann.5555 > collectd.51426: Flags [.], ack 38618, win 1452, option
```

... and without:
```
10:40:20.222933 IP collectd.51434 > riemann.5555: Flags [P.], seq 1380893891:1380894098, ack 3870418973, win 229, options [nop,nop,TS val 320208416 ecr 1751878719], length 207
10:40:20.242733 IP riemann.5555 > collectd.51434: Flags [P.], seq 1:7, ack 207, win 570, options [nop,nop,TS val 1751881011 ecr 320208416], length 6
10:40:20.242793 IP collectd.51434 > riemann.5555: Flags [.], ack 7, win 229, options [nop,nop,TS val 320208421 ecr 1751881011], length 0
10:40:20.242863 IP collectd.51434 > riemann.5555: Flags [P.], seq 207:414, ack 7, win 229, options [nop,nop,TS val 320208421 ecr 1751881011], length 207
10:40:20.266232 IP riemann.5555 > collectd.51434: Flags [P.], seq 7:13, ack 414, win 578, options [nop,nop,TS val 1751881017 ecr 320208421], length 6
10:40:20.266366 IP collectd.51434 > riemann.5555: Flags [P.], seq 414:621, ack 13, win 229, options [nop,nop,TS val 320208427 ecr 1751881017], length 207
10:40:20.286133 IP riemann.5555 > collectd.51434: Flags [P.], seq 13:19, ack 621, win 587, options [nop,nop,TS val 1751881022 ecr 320208427], length 6
10:40:20.286315 IP collectd.51434 > riemann.5555: Flags [P.], seq 621:832, ack 19, win 229, options [nop,nop,TS val 320208432 ecr 1751881022], length 211
10:40:20.304403 IP riemann.5555 > collectd.51434: Flags [P.], seq 19:25, ack 832, win 595, options [nop,nop,TS val 1751881026 ecr 320208432], length 6
10:40:20.304531 IP collectd.51434 > riemann.5555: Flags [P.], seq 832:1039, ack 25, win 229, options [nop,nop,TS val 320208437 ecr 1751881026], length 207
10:40:20.324280 IP riemann.5555 > collectd.51434: Flags [P.], seq 25:31, ack 1039, win 604, options [nop,nop,TS val 1751881031 ecr 320208437], length 6
10:40:20.324498 IP collectd.51434 > riemann.5555: Flags [P.], seq 1039:1250, ack 31, win 229, options [nop,nop,TS val 320208442 ecr 1751881031], length 211
10:40:20.344178 IP riemann.5555 > collectd.51434: Flags [P.], seq 31:37, ack 1250, win 612, options [nop,nop,TS val 1751881036 ecr 320208442], length 6
10:40:20.344417 IP collectd.51434 > riemann.5555: Flags [P.], seq 1250:1457, ack 37, win 229, options [nop,nop,TS val 320208447 ecr 1751881036], length 207
10:40:20.364238 IP riemann.5555 > collectd.51434: Flags [P.], seq 37:43, ack 1457, win 620, options [nop,nop,TS val 1751881041 ecr 320208447], length 6
10:40:20.364453 IP collectd.51434 > riemann.5555: Flags [P.], seq 1457:1664, ack 43, win 229, options [nop,nop,TS val 320208452 ecr 1751881041], length 207
10:40:20.384174 IP riemann.5555 > collectd.51434: Flags [P.], seq 43:49, ack 1664, win 629, options [nop,nop,TS val 1751881046 ecr 320208452], length 6
10:40:20.384392 IP collectd.51434 > riemann.5555: Flags [P.], seq 1664:1871, ack 49, win 229, options [nop,nop,TS val 320208457 ecr 1751881046], length 207
10:40:20.404176 IP riemann.5555 > collectd.51434: Flags [P.], seq 49:55, ack 1871, win 637, options [nop,nop,TS val 1751881051 ecr 320208457], length 6
10:40:20.404304 IP collectd.51434 > riemann.5555: Flags [P.], seq 1871:2078, ack 55, win 229, options [nop,nop,TS val 320208462 ecr 1751881051], length 207
10:40:20.422066 IP riemann.5555 > collectd.51434: Flags [P.], seq 55:61, ack 2078, win 645, options [nop,nop,TS val 1751881056 ecr 320208462], length 6
10:40:20.422182 IP collectd.51434 > riemann.5555: Flags [P.], seq 2078:2289, ack 61, win 229, options [nop,nop,TS val 320208466 ecr 1751881056], length 211
10:40:20.442403 IP riemann.5555 > collectd.51434: Flags [P.], seq 61:67, ack 2289, win 654, options [nop,nop,TS val 1751881061 ecr 320208466], length 6
10:40:20.442539 IP collectd.51434 > riemann.5555: Flags [P.], seq 2289:2500, ack 67, win 229, options [nop,nop,TS val 320208471 ecr 1751881061], length 211
10:40:20.462193 IP riemann.5555 > collectd.51434: Flags [P.], seq 67:73, ack 2500, win 662, options [nop,nop,TS val 1751881066 ecr 320208471], length 6
10:40:20.462357 IP collectd.51434 > riemann.5555: Flags [P.], seq 2500:2707, ack 73, win 229, options [nop,nop,TS val 320208476 ecr 1751881066], length 207
10:40:20.480258 IP riemann.5555 > collectd.51434: Flags [P.], seq 73:79, ack 2707, win 671, options [nop,nop,TS val 1751881070 ecr 320208476], length 6
10:40:20.480408 IP collectd.51434 > riemann.5555: Flags [P.], seq 2707:2924, ack 79, win 229, options [nop,nop,TS val 320208481 ecr 1751881070], length 217
10:40:20.500142 IP riemann.5555 > collectd.51434: Flags [P.], seq 79:85, ack 2924, win 679, options [nop,nop,TS val 1751881075 ecr 320208481], length 6
10:40:20.500287 IP collectd.51434 > riemann.5555: Flags [P.], seq 2924:3141, ack 85, win 229, options [nop,nop,TS val 320208486 ecr 1751881075], length 217
10:40:20.518253 IP riemann.5555 > collectd.51434: Flags [P.], seq 85:91, ack 3141, win 687, options [nop,nop,TS val 1751881080 ecr 320208486], length 6
10:40:20.518377 IP collectd.51434 > riemann.5555: Flags [P.], seq 3141:3348, ack 91, win 229, options [nop,nop,TS val 320208490 ecr 1751881080], length 207
10:40:20.537493 IP riemann.5555 > collectd.51434: Flags [P.], seq 91:97, ack 3348, win 696, options [nop,nop,TS val 1751881084 ecr 320208490], length 6
10:40:20.537620 IP collectd.51434 > riemann.5555: Flags [P.], seq 3348:3565, ack 97, win 229, options [nop,nop,TS val 320208495 ecr 1751881084], length 217
10:40:20.556049 IP riemann.5555 > collectd.51434: Flags [P.], seq 97:103, ack 3565, win 704, options [nop,nop,TS val 1751881089 ecr 320208495], length 6
10:40:20.556159 IP collectd.51434 > riemann.5555: Flags [P.], seq 3565:3772, ack 103, win 229, options [nop,nop,TS val 320208500 ecr 1751881089], length 207
10:40:20.576263 IP riemann.5555 > collectd.51434: Flags [P.], seq 103:109, ack 3772, win 712, options [nop,nop,TS val 1751881094 ecr 320208500], length 6
10:40:20.576408 IP collectd.51434 > riemann.5555: Flags [P.], seq 3772:3979, ack 109, win 229, options [nop,nop,TS val 320208505 ecr 1751881094], length 207
10:40:20.596391 IP riemann.5555 > collectd.51434: Flags [P.], seq 109:115, ack 3979, win 721, options [nop,nop,TS val 1751881099 ecr 320208505], length 6
10:40:20.596517 IP collectd.51434 > riemann.5555: Flags [P.], seq 3979:4196, ack 115, win 229, options [nop,nop,TS val 320208510 ecr 1751881099], length 217
10:40:20.616237 IP riemann.5555 > collectd.51434: Flags [P.], seq 115:121, ack 4196, win 729, options [nop,nop,TS val 1751881104 ecr 320208510], length 6
10:40:20.616372 IP collectd.51434 > riemann.5555: Flags [P.], seq 4196:4409, ack 121, win 229, options [nop,nop,TS val 320208515 ecr 1751881104], length 213
10:40:20.634495 IP riemann.5555 > collectd.51434: Flags [P.], seq 121:127, ack 4409, win 738, options [nop,nop,TS val 1751881109 ecr 320208515], length 6
10:40:20.634670 IP collectd.51434 > riemann.5555: Flags [P.], seq 4409:4618, ack 127, win 229, options [nop,nop,TS val 320208519 ecr 1751881109], length 209
10:40:20.654250 IP riemann.5555 > collectd.51434: Flags [P.], seq 127:133, ack 4618, win 746, options [nop,nop,TS val 1751881114 ecr 320208519], length 6
10:40:20.654318 IP collectd.51434 > riemann.5555: Flags [P.], seq 4618:4831, ack 133, win 229, options [nop,nop,TS val 320208524 ecr 1751881114], length 213
10:40:20.674696 IP riemann.5555 > collectd.51434: Flags [P.], seq 133:139, ack 4831, win 754, options [nop,nop,TS val 1751881119 ecr 320208524], length 6
10:40:20.674853 IP collectd.51434 > riemann.5555: Flags [P.], seq 4831:5040, ack 139, win 229, options [nop,nop,TS val 320208529 ecr 1751881119], length 209
10:40:20.694179 IP riemann.5555 > collectd.51434: Flags [P.], seq 139:145, ack 5040, win 763, options [nop,nop,TS val 1751881124 ecr 320208529], length 6
10:40:20.694288 IP collectd.51434 > riemann.5555: Flags [P.], seq 5040:5247, ack 145, win 229, options [nop,nop,TS val 320208534 ecr 1751881124], length 207
10:40:20.712077 IP riemann.5555 > collectd.51434: Flags [P.], seq 145:151, ack 5247, win 771, options [nop,nop,TS val 1751881128 ecr 320208534], length 6
10:40:20.712200 IP collectd.51434 > riemann.5555: Flags [P.], seq 5247:5460, ack 151, win 229, options [nop,nop,TS val 320208539 ecr 1751881128], length 213
10:40:20.730344 IP riemann.5555 > collectd.51434: Flags [P.], seq 151:157, ack 5460, win 779, options [nop,nop,TS val 1751881133 ecr 320208539], length 6
10:40:20.730473 IP collectd.51434 > riemann.5555: Flags [P.], seq 5460:5669, ack 157, win 229, options [nop,nop,TS val 320208543 ecr 1751881133], length 209
10:40:20.750144 IP riemann.5555 > collectd.51434: Flags [P.], seq 157:163, ack 5669, win 788, options [nop,nop,TS val 1751881138 ecr 320208543], length 6
10:40:20.750299 IP collectd.51434 > riemann.5555: Flags [P.], seq 5669:5882, ack 163, win 229, options [nop,nop,TS val 320208548 ecr 1751881138], length 213
10:40:20.768074 IP riemann.5555 > collectd.51434: Flags [P.], seq 163:169, ack 5882, win 796, options [nop,nop,TS val 1751881142 ecr 320208548], length 6
10:40:20.768226 IP collectd.51434 > riemann.5555: Flags [P.], seq 5882:6312, ack 169, win 229, options [nop,nop,TS val 320208553 ecr 1751881142], length 430
10:40:20.786683 IP riemann.5555 > collectd.51434: Flags [P.], seq 169:175, ack 6312, win 805, options [nop,nop,TS val 1751881147 ecr 320208553], length 6
10:40:20.786880 IP collectd.51434 > riemann.5555: Flags [P.], seq 6312:6746, ack 175, win 229, options [nop,nop,TS val 320208557 ecr 1751881147], length 434
10:40:20.806387 IP riemann.5555 > collectd.51434: Flags [P.], seq 175:181, ack 6746, win 813, options [nop,nop,TS val 1751881152 ecr 320208557], length 6
10:40:20.806516 IP collectd.51434 > riemann.5555: Flags [P.], seq 6746:6953, ack 181, win 229, options [nop,nop,TS val 320208562 ecr 1751881152], length 207
10:40:20.826079 IP riemann.5555 > collectd.51434: Flags [P.], seq 181:187, ack 6953, win 821, options [nop,nop,TS val 1751881157 ecr 320208562], length 6
10:40:20.826239 IP collectd.51434 > riemann.5555: Flags [P.], seq 6953:7160, ack 187, win 229, options [nop,nop,TS val 320208567 ecr 1751881157], length 207
10:40:20.846130 IP riemann.5555 > collectd.51434: Flags [P.], seq 187:193, ack 7160, win 830, options [nop,nop,TS val 1751881162 ecr 320208567], length 6
10:40:20.846265 IP collectd.51434 > riemann.5555: Flags [P.], seq 7160:7369, ack 193, win 229, options [nop,nop,TS val 320208572 ecr 1751881162], length 209
10:40:20.864343 IP riemann.5555 > collectd.51434: Flags [P.], seq 193:199, ack 7369, win 838, options [nop,nop,TS val 1751881166 ecr 320208572], length 6
10:40:20.864491 IP collectd.51434 > riemann.5555: Flags [P.], seq 7369:7576, ack 199, win 229, options [nop,nop,TS val 320208577 ecr 1751881166], length 207
10:40:20.884199 IP riemann.5555 > collectd.51434: Flags [P.], seq 199:205, ack 7576, win 846, options [nop,nop,TS val 1751881171 ecr 320208577], length 6
10:40:20.884345 IP collectd.51434 > riemann.5555: Flags [P.], seq 7576:8006, ack 205, win 229, options [nop,nop,TS val 320208582 ecr 1751881171], length 430
10:40:20.902379 IP riemann.5555 > collectd.51434: Flags [P.], seq 205:211, ack 8006, win 855, options [nop,nop,TS val 1751881176 ecr 320208582], length 6
10:40:20.902553 IP collectd.51434 > riemann.5555: Flags [P.], seq 8006:8420, ack 211, win 229, options [nop,nop,TS val 320208586 ecr 1751881176], length 414
10:40:20.922335 IP riemann.5555 > collectd.51434: Flags [P.], seq 211:217, ack 8420, win 863, options [nop,nop,TS val 1751881181 ecr 320208586], length 6
10:40:20.922489 IP collectd.51434 > riemann.5555: Flags [P.], seq 8420:8838, ack 217, win 229, options [nop,nop,TS val 320208591 ecr 1751881181], length 418
10:40:20.942289 IP riemann.5555 > collectd.51434: Flags [P.], seq 217:223, ack 8838, win 872, options [nop,nop,TS val 1751881186 ecr 320208591], length 6
10:40:20.942459 IP collectd.51434 > riemann.5555: Flags [P.], seq 8838:9252, ack 223, win 229, options [nop,nop,TS val 320208596 ecr 1751881186], length 414
10:40:20.962263 IP riemann.5555 > collectd.51434: Flags [P.], seq 223:229, ack 9252, win 880, options [nop,nop,TS val 1751881191 ecr 320208596], length 6
10:40:20.962429 IP collectd.51434 > riemann.5555: Flags [P.], seq 9252:9670, ack 229, win 229, options [nop,nop,TS val 320208601 ecr 1751881191], length 418
10:40:20.980494 IP riemann.5555 > collectd.51434: Flags [P.], seq 229:235, ack 9670, win 888, options [nop,nop,TS val 1751881195 ecr 320208601], length 6
10:40:20.980615 IP collectd.51434 > riemann.5555: Flags [P.], seq 9670:10092, ack 235, win 229, options [nop,nop,TS val 320208606 ecr 1751881195], length 422
10:40:21.000417 IP riemann.5555 > collectd.51434: Flags [P.], seq 235:241, ack 10092, win 897, options [nop,nop,TS val 1751881200 ecr 320208606], length 6
10:40:21.000544 IP collectd.51434 > riemann.5555: Flags [P.], seq 10092:10510, ack 241, win 229, options [nop,nop,TS val 320208611 ecr 1751881200], length 418
10:40:21.021666 IP riemann.5555 > collectd.51434: Flags [P.], seq 241:247, ack 10510, win 905, options [nop,nop,TS val 1751881205 ecr 320208611], length 6
10:40:21.021788 IP collectd.51434 > riemann.5555: Flags [P.], seq 10510:10924, ack 247, win 229, options [nop,nop,TS val 320208616 ecr 1751881205], length 414
10:40:21.042461 IP riemann.5555 > collectd.51434: Flags [P.], seq 247:253, ack 10924, win 913, options [nop,nop,TS val 1751881211 ecr 320208616], length 6
10:40:21.042635 IP collectd.51434 > riemann.5555: Flags [P.], seq 10924:11342, ack 253, win 229, options [nop,nop,TS val 320208621 ecr 1751881211], length 418
10:40:21.062396 IP riemann.5555 > collectd.51434: Flags [P.], seq 253:259, ack 11342, win 922, options [nop,nop,TS val 1751881216 ecr 320208621], length 6
10:40:21.062608 IP collectd.51434 > riemann.5555: Flags [P.], seq 11342:11756, ack 259, win 229, options [nop,nop,TS val 320208626 ecr 1751881216], length 414
10:40:21.082300 IP riemann.5555 > collectd.51434: Flags [P.], seq 259:265, ack 11756, win 930, options [nop,nop,TS val 1751881221 ecr 320208626], length 6
10:40:21.082432 IP collectd.51434 > riemann.5555: Flags [P.], seq 11756:12174, ack 265, win 229, options [nop,nop,TS val 320208631 ecr 1751881221], length 418
10:40:21.102461 IP riemann.5555 > collectd.51434: Flags [P.], seq 265:271, ack 12174, win 939, options [nop,nop,TS val 1751881226 ecr 320208631], length 6
10:40:21.102664 IP collectd.51434 > riemann.5555: Flags [P.], seq 12174:12596, ack 271, win 229, options [nop,nop,TS val 320208636 ecr 1751881226], length 422
10:40:21.122336 IP riemann.5555 > collectd.51434: Flags [P.], seq 271:277, ack 12596, win 947, options [nop,nop,TS val 1751881231 ecr 320208636], length 6
10:40:21.122529 IP collectd.51434 > riemann.5555: Flags [P.], seq 12596:13014, ack 277, win 229, options [nop,nop,TS val 320208641 ecr 1751881231], length 418
10:40:21.142340 IP riemann.5555 > collectd.51434: Flags [P.], seq 277:283, ack 13014, win 955, options [nop,nop,TS val 1751881236 ecr 320208641], length 6
10:40:21.142493 IP collectd.51434 > riemann.5555: Flags [P.], seq 13014:13440, ack 283, win 229, options [nop,nop,TS val 320208646 ecr 1751881236], length 426
10:40:21.162439 IP riemann.5555 > collectd.51434: Flags [P.], seq 283:289, ack 13440, win 964, options [nop,nop,TS val 1751881241 ecr 320208646], length 6
10:40:21.162589 IP collectd.51434 > riemann.5555: Flags [P.], seq 13440:13854, ack 289, win 229, options [nop,nop,TS val 320208651 ecr 1751881241], length 414
10:40:21.182452 IP riemann.5555 > collectd.51434: Flags [P.], seq 289:295, ack 13854, win 972, options [nop,nop,TS val 1751881246 ecr 320208651], length 6
10:40:21.182628 IP collectd.51434 > riemann.5555: Flags [P.], seq 13854:14260, ack 295, win 229, options [nop,nop,TS val 320208656 ecr 1751881246], length 406
10:40:21.202349 IP riemann.5555 > collectd.51434: Flags [P.], seq 295:301, ack 14260, win 980, options [nop,nop,TS val 1751881251 ecr 320208656], length 6
10:40:21.202533 IP collectd.51434 > riemann.5555: Flags [P.], seq 14260:14674, ack 301, win 229, options [nop,nop,TS val 320208661 ecr 1751881251], length 414
10:40:21.222310 IP riemann.5555 > collectd.51434: Flags [P.], seq 301:307, ack 14674, win 989, options [nop,nop,TS val 1751881256 ecr 320208661], length 6
10:40:21.222502 IP collectd.51434 > riemann.5555: Flags [P.], seq 14674:15092, ack 307, win 229, options [nop,nop,TS val 320208666 ecr 1751881256], length 418
10:40:21.242313 IP riemann.5555 > collectd.51434: Flags [P.], seq 307:313, ack 15092, win 997, options [nop,nop,TS val 1751881261 ecr 320208666], length 6
10:40:21.242442 IP collectd.51434 > riemann.5555: Flags [P.], seq 15092:15522, ack 313, win 229, options [nop,nop,TS val 320208671 ecr 1751881261], length 430
10:40:21.260435 IP riemann.5555 > collectd.51434: Flags [P.], seq 313:319, ack 15522, win 1006, options [nop,nop,TS val 1751881265 ecr 320208671], length 6
10:40:21.260539 IP collectd.51434 > riemann.5555: Flags [P.], seq 15522:15940, ack 319, win 229, options [nop,nop,TS val 320208676 ecr 1751881265], length 418
10:40:21.280704 IP riemann.5555 > collectd.51434: Flags [P.], seq 319:325, ack 15940, win 1014, options [nop,nop,TS val 1751881270 ecr 320208676], length 6
10:40:21.280819 IP collectd.51434 > riemann.5555: Flags [P.], seq 15940:16350, ack 325, win 229, options [nop,nop,TS val 320208681 ecr 1751881270], length 410
10:40:21.300293 IP riemann.5555 > collectd.51434: Flags [P.], seq 325:331, ack 16350, win 1022, options [nop,nop,TS val 1751881275 ecr 320208681], length 6
10:40:21.300404 IP collectd.51434 > riemann.5555: Flags [P.], seq 16350:16756, ack 331, win 229, options [nop,nop,TS val 320208686 ecr 1751881275], length 406
10:40:21.318490 IP riemann.5555 > collectd.51434: Flags [P.], seq 331:337, ack 16756, win 1031, options [nop,nop,TS val 1751881280 ecr 320208686], length 6
10:40:21.318658 IP collectd.51434 > riemann.5555: Flags [P.], seq 16756:17170, ack 337, win 229, options [nop,nop,TS val 320208690 ecr 1751881280], length 414
10:40:21.338338 IP riemann.5555 > collectd.51434: Flags [P.], seq 337:343, ack 17170, win 1039, options [nop,nop,TS val 1751881285 ecr 320208690], length 6
10:40:21.338451 IP collectd.51434 > riemann.5555: Flags [P.], seq 17170:17600, ack 343, win 229, options [nop,nop,TS val 320208695 ecr 1751881285], length 430
10:40:21.358343 IP riemann.5555 > collectd.51434: Flags [P.], seq 343:349, ack 17600, win 1047, options [nop,nop,TS val 1751881290 ecr 320208695], length 6
10:40:21.358459 IP collectd.51434 > riemann.5555: Flags [P.], seq 17600:18014, ack 349, win 229, options [nop,nop,TS val 320208700 ecr 1751881290], length 414
10:40:21.376465 IP riemann.5555 > collectd.51434: Flags [P.], seq 349:355, ack 18014, win 1056, options [nop,nop,TS val 1751881294 ecr 320208700], length 6
10:40:21.376610 IP collectd.51434 > riemann.5555: Flags [P.], seq 18014:18444, ack 355, win 229, options [nop,nop,TS val 320208705 ecr 1751881294], length 430
10:40:21.396351 IP riemann.5555 > collectd.51434: Flags [P.], seq 355:361, ack 18444, win 1064, options [nop,nop,TS val 1751881299 ecr 320208705], length 6
10:40:21.396544 IP collectd.51434 > riemann.5555: Flags [P.], seq 18444:18874, ack 361, win 229, options [nop,nop,TS val 320208710 ecr 1751881299], length 430
10:40:21.416354 IP riemann.5555 > collectd.51434: Flags [P.], seq 361:367, ack 18874, win 1073, options [nop,nop,TS val 1751881304 ecr 320208710], length 6
10:40:21.416518 IP collectd.51434 > riemann.5555: Flags [P.], seq 18874:19300, ack 367, win 229, options [nop,nop,TS val 320208715 ecr 1751881304], length 426
10:40:21.436712 IP riemann.5555 > collectd.51434: Flags [P.], seq 367:373, ack 19300, win 1081, options [nop,nop,TS val 1751881309 ecr 320208715], length 6
10:40:21.436846 IP collectd.51434 > riemann.5555: Flags [P.], seq 19300:19730, ack 373, win 229, options [nop,nop,TS val 320208720 ecr 1751881309], length 430
10:40:21.456389 IP riemann.5555 > collectd.51434: Flags [P.], seq 373:379, ack 19730, win 1089, options [nop,nop,TS val 1751881314 ecr 320208720], length 6
10:40:21.456529 IP collectd.51434 > riemann.5555: Flags [P.], seq 19730:20164, ack 379, win 229, options [nop,nop,TS val 320208725 ecr 1751881314], length 434
10:40:21.478635 IP riemann.5555 > collectd.51434: Flags [P.], seq 379:385, ack 20164, win 1098, options [nop,nop,TS val 1751881320 ecr 320208725], length 6
10:40:21.478723 IP collectd.51434 > riemann.5555: Flags [P.], seq 20164:20598, ack 385, win 229, options [nop,nop,TS val 320208730 ecr 1751881320], length 434
10:40:21.501462 IP riemann.5555 > collectd.51434: Flags [P.], seq 385:391, ack 20598, win 1106, options [nop,nop,TS val 1751881325 ecr 320208730], length 6
10:40:21.501591 IP collectd.51434 > riemann.5555: Flags [P.], seq 20598:20787, ack 391, win 229, options [nop,nop,TS val 320208736 ecr 1751881325], length 189
10:40:21.520388 IP riemann.5555 > collectd.51434: Flags [P.], seq 391:397, ack 20787, win 1114, options [nop,nop,TS val 1751881330 ecr 320208736], length 6
10:40:21.520496 IP collectd.51434 > riemann.5555: Flags [P.], seq 20787:20990, ack 397, win 229, options [nop,nop,TS val 320208741 ecr 1751881330], length 203
10:40:21.540299 IP riemann.5555 > collectd.51434: Flags [P.], seq 397:403, ack 20990, win 1123, options [nop,nop,TS val 1751881335 ecr 320208741], length 6
10:40:21.540422 IP collectd.51434 > riemann.5555: Flags [P.], seq 20990:21187, ack 403, win 229, options [nop,nop,TS val 320208746 ecr 1751881335], length 197
10:40:21.558287 IP riemann.5555 > collectd.51434: Flags [P.], seq 403:409, ack 21187, win 1131, options [nop,nop,TS val 1751881340 ecr 320208746], length 6
10:40:21.558408 IP collectd.51434 > riemann.5555: Flags [P.], seq 21187:21380, ack 409, win 229, options [nop,nop,TS val 320208750 ecr 1751881340], length 193
10:40:21.576325 IP riemann.5555 > collectd.51434: Flags [P.], seq 409:415, ack 21380, win 1140, options [nop,nop,TS val 1751881344 ecr 320208750], length 6
10:40:21.576446 IP collectd.51434 > riemann.5555: Flags [P.], seq 21380:21867, ack 415, win 229, options [nop,nop,TS val 320208755 ecr 1751881344], length 487
10:40:21.594734 IP riemann.5555 > collectd.51434: Flags [P.], seq 415:421, ack 21867, win 1148, options [nop,nop,TS val 1751881349 ecr 320208755], length 6
10:40:21.594840 IP collectd.51434 > riemann.5555: Flags [P.], seq 21867:22056, ack 421, win 229, options [nop,nop,TS val 320208759 ecr 1751881349], length 189
10:40:21.614585 IP riemann.5555 > collectd.51434: Flags [P.], seq 421:427, ack 22056, win 1156, options [nop,nop,TS val 1751881354 ecr 320208759], length 6
10:40:21.614704 IP collectd.51434 > riemann.5555: Flags [P.], seq 22056:22255, ack 427, win 229, options [nop,nop,TS val 320208764 ecr 1751881354], length 199
10:40:21.634560 IP riemann.5555 > collectd.51434: Flags [P.], seq 427:433, ack 22255, win 1165, options [nop,nop,TS val 1751881359 ecr 320208764], length 6
10:40:21.671317 IP collectd.51434 > riemann.5555: Flags [.], ack 433, win 229, options [nop,nop,TS val 320208779 ecr 1751881359], length 0
10:40:30.222927 IP collectd.51434 > riemann.5555: Flags [P.], seq 22255:22462, ack 433, win 229, options [nop,nop,TS val 320210916 ecr 1751881359], length 207
10:40:30.242117 IP riemann.5555 > collectd.51434: Flags [P.], seq 433:439, ack 22462, win 1173, options [nop,nop,TS val 1751883511 ecr 320210916], length 6
10:40:30.242180 IP collectd.51434 > riemann.5555: Flags [.], ack 439, win 229, options [nop,nop,TS val 320210921 ecr 1751883511], length 0
10:40:30.242259 IP collectd.51434 > riemann.5555: Flags [P.], seq 22462:22669, ack 439, win 229, options [nop,nop,TS val 320210921 ecr 1751883511], length 207
10:40:30.265563 IP riemann.5555 > collectd.51434: Flags [P.], seq 439:445, ack 22669, win 1181, options [nop,nop,TS val 1751883516 ecr 320210921], length 6
10:40:30.265697 IP collectd.51434 > riemann.5555: Flags [P.], seq 22669:22880, ack 445, win 229, options [nop,nop,TS val 320210927 ecr 1751883516], length 211
10:40:30.285950 IP riemann.5555 > collectd.51434: Flags [P.], seq 445:451, ack 22880, win 1190, options [nop,nop,TS val 1751883521 ecr 320210927], length 6
10:40:30.286062 IP collectd.51434 > riemann.5555: Flags [P.], seq 22880:23091, ack 451, win 229, options [nop,nop,TS val 320210932 ecr 1751883521], length 211
10:40:30.306044 IP riemann.5555 > collectd.51434: Flags [P.], seq 451:457, ack 23091, win 1198, options [nop,nop,TS val 1751883527 ecr 320210932], length 6
10:40:30.306202 IP collectd.51434 > riemann.5555: Flags [P.], seq 23091:23298, ack 457, win 229, options [nop,nop,TS val 320210937 ecr 1751883527], length 207
10:40:30.325874 IP riemann.5555 > collectd.51434: Flags [P.], seq 457:463, ack 23298, win 1207, options [nop,nop,TS val 1751883532 ecr 320210937], length 6
10:40:30.325974 IP collectd.51434 > riemann.5555: Flags [P.], seq 23298:23509, ack 463, win 229, options [nop,nop,TS val 320210942 ecr 1751883532], length 211
10:40:30.345718 IP riemann.5555 > collectd.51434: Flags [P.], seq 463:469, ack 23509, win 1215, options [nop,nop,TS val 1751883536 ecr 320210942], length 6
10:40:30.345859 IP collectd.51434 > riemann.5555: Flags [P.], seq 23509:23716, ack 469, win 229, options [nop,nop,TS val 320210947 ecr 1751883536], length 207
10:40:30.363755 IP riemann.5555 > collectd.51434: Flags [P.], seq 469:475, ack 23716, win 1223, options [nop,nop,TS val 1751883541 ecr 320210947], length 6
10:40:30.363850 IP collectd.51434 > riemann.5555: Flags [P.], seq 23716:23923, ack 475, win 229, options [nop,nop,TS val 320210952 ecr 1751883541], length 207
10:40:30.382031 IP riemann.5555 > collectd.51434: Flags [P.], seq 475:481, ack 23923, win 1232, options [nop,nop,TS val 1751883546 ecr 320210952], length 6
10:40:30.382131 IP collectd.51434 > riemann.5555: Flags [P.], seq 23923:24134, ack 481, win 229, options [nop,nop,TS val 320210956 ecr 1751883546], length 211
10:40:30.401669 IP riemann.5555 > collectd.51434: Flags [P.], seq 481:487, ack 24134, win 1240, options [nop,nop,TS val 1751883551 ecr 320210956], length 6
10:40:30.401813 IP collectd.51434 > riemann.5555: Flags [P.], seq 24134:24341, ack 487, win 229, options [nop,nop,TS val 320210961 ecr 1751883551], length 207
10:40:30.419882 IP riemann.5555 > collectd.51434: Flags [P.], seq 487:493, ack 24341, win 1248, options [nop,nop,TS val 1751883555 ecr 320210961], length 6
10:40:30.420017 IP collectd.51434 > riemann.5555: Flags [P.], seq 24341:24548, ack 493, win 229, options [nop,nop,TS val 320210966 ecr 1751883555], length 207
10:40:30.446017 IP riemann.5555 > collectd.51434: Flags [P.], seq 493:499, ack 24548, win 1257, options [nop,nop,TS val 1751883562 ecr 320210966], length 6
10:40:30.446134 IP collectd.51434 > riemann.5555: Flags [P.], seq 24548:24755, ack 499, win 229, options [nop,nop,TS val 320210972 ecr 1751883562], length 207
10:40:30.465635 IP riemann.5555 > collectd.51434: Flags [P.], seq 499:505, ack 24755, win 1265, options [nop,nop,TS val 1751883567 ecr 320210972], length 6
10:40:30.465747 IP collectd.51434 > riemann.5555: Flags [P.], seq 24755:24962, ack 505, win 229, options [nop,nop,TS val 320210977 ecr 1751883567], length 207
10:40:30.483768 IP riemann.5555 > collectd.51434: Flags [P.], seq 505:511, ack 24962, win 1274, options [nop,nop,TS val 1751883571 ecr 320210977], length 6
10:40:30.483905 IP collectd.51434 > riemann.5555: Flags [P.], seq 24962:25169, ack 511, win 229, options [nop,nop,TS val 320210982 ecr 1751883571], length 207
10:40:30.503609 IP riemann.5555 > collectd.51434: Flags [P.], seq 511:517, ack 25169, win 1282, options [nop,nop,TS val 1751883576 ecr 320210982], length 6
10:40:30.503712 IP collectd.51434 > riemann.5555: Flags [P.], seq 25169:25376, ack 517, win 229, options [nop,nop,TS val 320210987 ecr 1751883576], length 207
10:40:30.521611 IP riemann.5555 > collectd.51434: Flags [P.], seq 517:523, ack 25376, win 1290, options [nop,nop,TS val 1751883581 ecr 320210987], length 6
10:40:30.521751 IP collectd.51434 > riemann.5555: Flags [P.], seq 25376:25583, ack 523, win 229, options [nop,nop,TS val 320210991 ecr 1751883581], length 207
10:40:30.539639 IP riemann.5555 > collectd.51434: Flags [P.], seq 523:529, ack 25583, win 1299, options [nop,nop,TS val 1751883585 ecr 320210991], length 6
10:40:30.539783 IP collectd.51434 > riemann.5555: Flags [P.], seq 25583:25800, ack 529, win 229, options [nop,nop,TS val 320210996 ecr 1751883585], length 217
10:40:30.567081 IP riemann.5555 > collectd.51434: Flags [P.], seq 529:535, ack 25800, win 1307, options [nop,nop,TS val 1751883592 ecr 320210996], length 6
10:40:30.567269 IP collectd.51434 > riemann.5555: Flags [P.], seq 25800:26017, ack 535, win 229, options [nop,nop,TS val 320211002 ecr 1751883592], length 217
10:40:30.586013 IP riemann.5555 > collectd.51434: Flags [P.], seq 535:541, ack 26017, win 1315, options [nop,nop,TS val 1751883597 ecr 320211002], length 6
10:40:30.586146 IP collectd.51434 > riemann.5555: Flags [P.], seq 26017:26230, ack 541, win 229, options [nop,nop,TS val 320211007 ecr 1751883597], length 213
10:40:30.609642 IP riemann.5555 > collectd.51434: Flags [P.], seq 541:547, ack 26230, win 1324, options [nop,nop,TS val 1751883602 ecr 320211007], length 6
10:40:30.609774 IP collectd.51434 > riemann.5555: Flags [P.], seq 26230:26443, ack 547, win 229, options [nop,nop,TS val 320211013 ecr 1751883602], length 213
10:40:30.627647 IP riemann.5555 > collectd.51434: Flags [P.], seq 547:553, ack 26443, win 1332, options [nop,nop,TS val 1751883607 ecr 320211013], length 6
10:40:30.627793 IP collectd.51434 > riemann.5555: Flags [P.], seq 26443:26652, ack 553, win 229, options [nop,nop,TS val 320211018 ecr 1751883607], length 209
10:40:30.650456 IP riemann.5555 > collectd.51434: Flags [P.], seq 553:559, ack 26652, win 1341, options [nop,nop,TS val 1751883613 ecr 320211018], length 6
10:40:30.650578 IP collectd.51434 > riemann.5555: Flags [P.], seq 26652:26865, ack 559, win 229, options [nop,nop,TS val 320211023 ecr 1751883613], length 213
10:40:30.669831 IP riemann.5555 > collectd.51434: Flags [P.], seq 559:565, ack 26865, win 1349, options [nop,nop,TS val 1751883618 ecr 320211023], length 6
10:40:30.669988 IP collectd.51434 > riemann.5555: Flags [P.], seq 26865:27082, ack 565, win 229, options [nop,nop,TS val 320211028 ecr 1751883618], length 217
10:40:30.689774 IP riemann.5555 > collectd.51434: Flags [P.], seq 565:571, ack 27082, win 1357, options [nop,nop,TS val 1751883623 ecr 320211028], length 6
10:40:30.689917 IP collectd.51434 > riemann.5555: Flags [P.], seq 27082:27299, ack 571, win 229, options [nop,nop,TS val 320211033 ecr 1751883623], length 217
10:40:30.709949 IP riemann.5555 > collectd.51434: Flags [P.], seq 571:577, ack 27299, win 1366, options [nop,nop,TS val 1751883628 ecr 320211033], length 6
10:40:30.710056 IP collectd.51434 > riemann.5555: Flags [P.], seq 27299:27512, ack 577, win 229, options [nop,nop,TS val 320211038 ecr 1751883628], length 213
10:40:30.729751 IP riemann.5555 > collectd.51434: Flags [P.], seq 577:583, ack 27512, win 1374, options [nop,nop,TS val 1751883633 ecr 320211038], length 6
10:40:30.729869 IP collectd.51434 > riemann.5555: Flags [P.], seq 27512:27721, ack 583, win 229, options [nop,nop,TS val 320211043 ecr 1751883633], length 209
10:40:30.750081 IP riemann.5555 > collectd.51434: Flags [P.], seq 583:589, ack 27721, win 1382, options [nop,nop,TS val 1751883638 ecr 320211043], length 6
10:40:30.750198 IP collectd.51434 > riemann.5555: Flags [P.], seq 27721:27930, ack 589, win 229, options [nop,nop,TS val 320211048 ecr 1751883638], length 209
10:40:30.769654 IP riemann.5555 > collectd.51434: Flags [P.], seq 589:595, ack 27930, win 1391, options [nop,nop,TS val 1751883643 ecr 320211048], length 6
10:40:30.769836 IP collectd.51434 > riemann.5555: Flags [P.], seq 27930:28139, ack 595, win 229, options [nop,nop,TS val 320211053 ecr 1751883643], length 209
10:40:30.789664 IP riemann.5555 > collectd.51434: Flags [P.], seq 595:601, ack 28139, win 1399, options [nop,nop,TS val 1751883648 ecr 320211053], length 6
10:40:30.789830 IP collectd.51434 > riemann.5555: Flags [P.], seq 28139:28346, ack 601, win 229, options [nop,nop,TS val 320211058 ecr 1751883648], length 207
10:40:30.808902 IP riemann.5555 > collectd.51434: Flags [P.], seq 601:607, ack 28346, win 1408, options [nop,nop,TS val 1751883652 ecr 320211058], length 6
10:40:30.808998 IP collectd.51434 > riemann.5555: Flags [P.], seq 28346:28553, ack 607, win 229, options [nop,nop,TS val 320211063 ecr 1751883652], length 207
10:40:30.828467 IP riemann.5555 > collectd.51434: Flags [P.], seq 607:613, ack 28553, win 1416, options [nop,nop,TS val 1751883657 ecr 320211063], length 6
10:40:30.828587 IP collectd.51434 > riemann.5555: Flags [P.], seq 28553:28760, ack 613, win 229, options [nop,nop,TS val 320211068 ecr 1751883657], length 207
10:40:30.847992 IP riemann.5555 > collectd.51434: Flags [P.], seq 613:619, ack 28760, win 1424, options [nop,nop,TS val 1751883662 ecr 320211068], length 6
10:40:30.848123 IP collectd.51434 > riemann.5555: Flags [P.], seq 28760:28967, ack 619, win 229, options [nop,nop,TS val 320211073 ecr 1751883662], length 207
10:40:30.868747 IP riemann.5555 > collectd.51434: Flags [P.], seq 619:625, ack 28967, win 1433, options [nop,nop,TS val 1751883667 ecr 320211073], length 6
10:40:30.868878 IP collectd.51434 > riemann.5555: Flags [P.], seq 28967:29397, ack 625, win 229, options [nop,nop,TS val 320211078 ecr 1751883667], length 430
10:40:30.895940 IP riemann.5555 > collectd.51434: Flags [P.], seq 625:631, ack 29397, win 1441, options [nop,nop,TS val 1751883674 ecr 320211078], length 6
10:40:30.896053 IP collectd.51434 > riemann.5555: Flags [P.], seq 29397:29831, ack 631, win 229, options [nop,nop,TS val 320211085 ecr 1751883674], length 434
10:40:30.915811 IP riemann.5555 > collectd.51434: Flags [P.], seq 631:637, ack 29831, win 1449, options [nop,nop,TS val 1751883679 ecr 320211085], length 6
10:40:30.915988 IP collectd.51434 > riemann.5555: Flags [P.], seq 29831:30261, ack 637, win 229, options [nop,nop,TS val 320211090 ecr 1751883679], length 430
10:40:30.935999 IP riemann.5555 > collectd.51434: Flags [P.], seq 637:643, ack 30261, win 1452, options [nop,nop,TS val 1751883684 ecr 320211090], length 6
10:40:30.936133 IP collectd.51434 > riemann.5555: Flags [P.], seq 30261:30675, ack 643, win 229, options [nop,nop,TS val 320211095 ecr 1751883684], length 414
10:40:30.956034 IP riemann.5555 > collectd.51434: Flags [P.], seq 643:649, ack 30675, win 1452, options [nop,nop,TS val 1751883689 ecr 320211095], length 6
10:40:30.956145 IP collectd.51434 > riemann.5555: Flags [P.], seq 30675:31093, ack 649, win 229, options [nop,nop,TS val 320211100 ecr 1751883689], length 418
10:40:30.976021 IP riemann.5555 > collectd.51434: Flags [P.], seq 649:655, ack 31093, win 1452, options [nop,nop,TS val 1751883694 ecr 320211100], length 6
10:40:30.976128 IP collectd.51434 > riemann.5555: Flags [P.], seq 31093:31507, ack 655, win 229, options [nop,nop,TS val 320211105 ecr 1751883694], length 414
10:40:30.996234 IP riemann.5555 > collectd.51434: Flags [P.], seq 655:661, ack 31507, win 1452, options [nop,nop,TS val 1751883699 ecr 320211105], length 6
10:40:30.996332 IP collectd.51434 > riemann.5555: Flags [P.], seq 31507:31925, ack 661, win 229, options [nop,nop,TS val 320211110 ecr 1751883699], length 418
10:40:31.016294 IP riemann.5555 > collectd.51434: Flags [P.], seq 661:667, ack 31925, win 1452, options [nop,nop,TS val 1751883704 ecr 320211110], length 6
10:40:31.016474 IP collectd.51434 > riemann.5555: Flags [P.], seq 31925:32347, ack 667, win 229, options [nop,nop,TS val 320211115 ecr 1751883704], length 422
10:40:31.035940 IP riemann.5555 > collectd.51434: Flags [P.], seq 667:673, ack 32347, win 1452, options [nop,nop,TS val 1751883709 ecr 320211115], length 6
10:40:31.036100 IP collectd.51434 > riemann.5555: Flags [P.], seq 32347:32765, ack 673, win 229, options [nop,nop,TS val 320211120 ecr 1751883709], length 418
10:40:31.055838 IP riemann.5555 > collectd.51434: Flags [P.], seq 673:679, ack 32765, win 1452, options [nop,nop,TS val 1751883714 ecr 320211120], length 6
10:40:31.055967 IP collectd.51434 > riemann.5555: Flags [P.], seq 32765:33179, ack 679, win 229, options [nop,nop,TS val 320211125 ecr 1751883714], length 414
10:40:31.075944 IP riemann.5555 > collectd.51434: Flags [P.], seq 679:685, ack 33179, win 1452, options [nop,nop,TS val 1751883719 ecr 320211125], length 6
10:40:31.076074 IP collectd.51434 > riemann.5555: Flags [P.], seq 33179:33597, ack 685, win 229, options [nop,nop,TS val 320211130 ecr 1751883719], length 418
10:40:31.095949 IP riemann.5555 > collectd.51434: Flags [P.], seq 685:691, ack 33597, win 1452, options [nop,nop,TS val 1751883724 ecr 320211130], length 6
10:40:31.096050 IP collectd.51434 > riemann.5555: Flags [P.], seq 33597:34011, ack 691, win 229, options [nop,nop,TS val 320211135 ecr 1751883724], length 414
10:40:31.116034 IP riemann.5555 > collectd.51434: Flags [P.], seq 691:697, ack 34011, win 1452, options [nop,nop,TS val 1751883729 ecr 320211135], length 6
10:40:31.116177 IP collectd.51434 > riemann.5555: Flags [P.], seq 34011:34429, ack 697, win 229, options [nop,nop,TS val 320211140 ecr 1751883729], length 418
10:40:31.135955 IP riemann.5555 > collectd.51434: Flags [P.], seq 697:703, ack 34429, win 1452, options [nop,nop,TS val 1751883734 ecr 320211140], length 6
10:40:31.136096 IP collectd.51434 > riemann.5555: Flags [P.], seq 34429:34851, ack 703, win 229, options [nop,nop,TS val 320211145 ecr 1751883734], length 422
10:40:31.155901 IP riemann.5555 > collectd.51434: Flags [P.], seq 703:709, ack 34851, win 1452, options [nop,nop,TS val 1751883739 ecr 320211145], length 6
10:40:31.156042 IP collectd.51434 > riemann.5555: Flags [P.], seq 34851:35269, ack 709, win 229, options [nop,nop,TS val 320211150 ecr 1751883739], length 418
10:40:31.174902 IP riemann.5555 > collectd.51434: Flags [P.], seq 709:715, ack 35269, win 1452, options [nop,nop,TS val 1751883744 ecr 320211150], length 6
10:40:31.175011 IP collectd.51434 > riemann.5555: Flags [P.], seq 35269:35695, ack 715, win 229, options [nop,nop,TS val 320211154 ecr 1751883744], length 426
10:40:31.193816 IP riemann.5555 > collectd.51434: Flags [P.], seq 715:721, ack 35695, win 1452, options [nop,nop,TS val 1751883749 ecr 320211154], length 6
10:40:31.193918 IP collectd.51434 > riemann.5555: Flags [P.], seq 35695:36125, ack 721, win 229, options [nop,nop,TS val 320211159 ecr 1751883749], length 430
10:40:31.213846 IP riemann.5555 > collectd.51434: Flags [P.], seq 721:727, ack 36125, win 1452, options [nop,nop,TS val 1751883753 ecr 320211159], length 6
10:40:31.214002 IP collectd.51434 > riemann.5555: Flags [P.], seq 36125:36551, ack 727, win 229, options [nop,nop,TS val 320211164 ecr 1751883753], length 426
10:40:31.234144 IP riemann.5555 > collectd.51434: Flags [P.], seq 727:733, ack 36551, win 1452, options [nop,nop,TS val 1751883759 ecr 320211164], length 6
10:40:31.234294 IP collectd.51434 > riemann.5555: Flags [P.], seq 36551:36965, ack 733, win 229, options [nop,nop,TS val 320211169 ecr 1751883759], length 414
10:40:31.254215 IP riemann.5555 > collectd.51434: Flags [P.], seq 733:739, ack 36965, win 1452, options [nop,nop,TS val 1751883764 ecr 320211169], length 6
10:40:31.254328 IP collectd.51434 > riemann.5555: Flags [P.], seq 36965:37383, ack 739, win 229, options [nop,nop,TS val 320211174 ecr 1751883764], length 418
10:40:31.273890 IP riemann.5555 > collectd.51434: Flags [P.], seq 739:745, ack 37383, win 1452, options [nop,nop,TS val 1751883769 ecr 320211174], length 6
10:40:31.274060 IP collectd.51434 > riemann.5555: Flags [P.], seq 37383:37797, ack 745, win 229, options [nop,nop,TS val 320211179 ecr 1751883769], length 414
10:40:31.294351 IP riemann.5555 > collectd.51434: Flags [P.], seq 745:751, ack 37797, win 1452, options [nop,nop,TS val 1751883774 ecr 320211179], length 6
10:40:31.294575 IP collectd.51434 > riemann.5555: Flags [P.], seq 37797:38215, ack 751, win 229, options [nop,nop,TS val 320211184 ecr 1751883774], length 418
10:40:31.314187 IP riemann.5555 > collectd.51434: Flags [P.], seq 751:757, ack 38215, win 1452, options [nop,nop,TS val 1751883779 ecr 320211184], length 6
10:40:31.314307 IP collectd.51434 > riemann.5555: Flags [P.], seq 38215:38625, ack 757, win 229, options [nop,nop,TS val 320211189 ecr 1751883779], length 410
10:40:31.334182 IP riemann.5555 > collectd.51434: Flags [P.], seq 757:763, ack 38625, win 1452, options [nop,nop,TS val 1751883784 ecr 320211189], length 6
10:40:31.334338 IP collectd.51434 > riemann.5555: Flags [P.], seq 38625:39055, ack 763, win 229, options [nop,nop,TS val 320211194 ecr 1751883784], length 430
10:40:31.354257 IP riemann.5555 > collectd.51434: Flags [P.], seq 763:769, ack 39055, win 1452, options [nop,nop,TS val 1751883789 ecr 320211194], length 6
10:40:31.354419 IP collectd.51434 > riemann.5555: Flags [P.], seq 39055:39469, ack 769, win 229, options [nop,nop,TS val 320211199 ecr 1751883789], length 414
10:40:31.373996 IP riemann.5555 > collectd.51434: Flags [P.], seq 769:775, ack 39469, win 1452, options [nop,nop,TS val 1751883794 ecr 320211199], length 6
10:40:31.374148 IP collectd.51434 > riemann.5555: Flags [P.], seq 39469:39875, ack 775, win 229, options [nop,nop,TS val 320211204 ecr 1751883794], length 406
10:40:31.393912 IP riemann.5555 > collectd.51434: Flags [P.], seq 775:781, ack 39875, win 1452, options [nop,nop,TS val 1751883799 ecr 320211204], length 6
10:40:31.394088 IP collectd.51434 > riemann.5555: Flags [P.], seq 39875:40289, ack 781, win 229, options [nop,nop,TS val 320211209 ecr 1751883799], length 414
10:40:31.414234 IP riemann.5555 > collectd.51434: Flags [P.], seq 781:787, ack 40289, win 1452, options [nop,nop,TS val 1751883804 ecr 320211209], length 6
10:40:31.414436 IP collectd.51434 > riemann.5555: Flags [P.], seq 40289:40723, ack 787, win 229, options [nop,nop,TS val 320211214 ecr 1751883804], length 434
10:40:31.434869 IP riemann.5555 > collectd.51434: Flags [P.], seq 787:793, ack 40723, win 1452, options [nop,nop,TS val 1751883809 ecr 320211214], length 6
10:40:31.435043 IP collectd.51434 > riemann.5555: Flags [P.], seq 40723:41153, ack 793, win 229, options [nop,nop,TS val 320211219 ecr 1751883809], length 430
10:40:31.453725 IP riemann.5555 > collectd.51434: Flags [P.], seq 793:799, ack 41153, win 1452, options [nop,nop,TS val 1751883814 ecr 320211219], length 6
10:40:31.453919 IP collectd.51434 > riemann.5555: Flags [P.], seq 41153:41583, ack 799, win 229, options [nop,nop,TS val 320211224 ecr 1751883814], length 430
10:40:31.473833 IP riemann.5555 > collectd.51434: Flags [P.], seq 799:805, ack 41583, win 1452, options [nop,nop,TS val 1751883819 ecr 320211224], length 6
10:40:31.473931 IP collectd.51434 > riemann.5555: Flags [P.], seq 41583:42013, ack 805, win 229, options [nop,nop,TS val 320211229 ecr 1751883819], length 430
10:40:31.491853 IP riemann.5555 > collectd.51434: Flags [P.], seq 805:811, ack 42013, win 1452, options [nop,nop,TS val 1751883823 ecr 320211229], length 6
10:40:31.492015 IP collectd.51434 > riemann.5555: Flags [P.], seq 42013:42419, ack 811, win 229, options [nop,nop,TS val 320211234 ecr 1751883823], length 406
10:40:31.511867 IP riemann.5555 > collectd.51434: Flags [P.], seq 811:817, ack 42419, win 1452, options [nop,nop,TS val 1751883828 ecr 320211234], length 6
10:40:31.511977 IP collectd.51434 > riemann.5555: Flags [P.], seq 42419:42853, ack 817, win 229, options [nop,nop,TS val 320211239 ecr 1751883828], length 434
10:40:31.531848 IP riemann.5555 > collectd.51434: Flags [P.], seq 817:823, ack 42853, win 1452, options [nop,nop,TS val 1751883833 ecr 320211239], length 6
10:40:31.531955 IP collectd.51434 > riemann.5555: Flags [P.], seq 42853:43340, ack 823, win 229, options [nop,nop,TS val 320211244 ecr 1751883833], length 487
10:40:31.550198 IP riemann.5555 > collectd.51434: Flags [P.], seq 823:829, ack 43340, win 1452, options [nop,nop,TS val 1751883838 ecr 320211244], length 6
10:40:31.550414 IP collectd.51434 > riemann.5555: Flags [P.], seq 43340:43543, ack 829, win 229, options [nop,nop,TS val 320211248 ecr 1751883838], length 203
10:40:31.569683 IP riemann.5555 > collectd.51434: Flags [P.], seq 829:835, ack 43543, win 1452, options [nop,nop,TS val 1751883843 ecr 320211248], length 6
10:40:31.569860 IP collectd.51434 > riemann.5555: Flags [P.], seq 43543:43740, ack 835, win 229, options [nop,nop,TS val 320211253 ecr 1751883843], length 197
10:40:31.587728 IP riemann.5555 > collectd.51434: Flags [P.], seq 835:841, ack 43740, win 1452, options [nop,nop,TS val 1751883847 ecr 320211253], length 6
10:40:31.587852 IP collectd.51434 > riemann.5555: Flags [P.], seq 43740:43933, ack 841, win 229, options [nop,nop,TS val 320211258 ecr 1751883847], length 193
10:40:31.606598 IP riemann.5555 > collectd.51434: Flags [P.], seq 841:847, ack 43933, win 1452, options [nop,nop,TS val 1751883852 ecr 320211258], length 6
10:40:31.606724 IP collectd.51434 > riemann.5555: Flags [P.], seq 43933:44122, ack 847, win 229, options [nop,nop,TS val 320211262 ecr 1751883852], length 189
10:40:31.626040 IP riemann.5555 > collectd.51434: Flags [P.], seq 847:853, ack 44122, win 1452, options [nop,nop,TS val 1751883857 ecr 320211262], length 6
10:40:31.626168 IP collectd.51434 > riemann.5555: Flags [P.], seq 44122:44311, ack 853, win 229, options [nop,nop,TS val 320211267 ecr 1751883857], length 189
10:40:31.646127 IP riemann.5555 > collectd.51434: Flags [P.], seq 853:859, ack 44311, win 1452, options [nop,nop,TS val 1751883862 ecr 320211267], length 6
10:40:31.646244 IP collectd.51434 > riemann.5555: Flags [P.], seq 44311:44510, ack 859, win 229, options [nop,nop,TS val 320211272 ecr 1751883862], length 199
10:40:31.665853 IP riemann.5555 > collectd.51434: Flags [P.], seq 859:865, ack 44510, win 1452, options [nop,nop,TS val 1751883867 ecr 320211272], length 6
10:40:31.703293 IP collectd.51434 > riemann.5555: Flags [.], ack 865, win 229, options [nop,nop,TS val 320211287 ecr 1751883867], length 0
10:40:40.222941 IP collectd.51434 > riemann.5555: Flags [P.], seq 44510:44717, ack 865, win 229, options [nop,nop,TS val 320213416 ecr 1751883867], length 207
10:40:40.241384 IP riemann.5555 > collectd.51434: Flags [P.], seq 865:871, ack 44717, win 1452, options [nop,nop,TS val 1751886010 ecr 320213416], length 6
10:40:40.241447 IP collectd.51434 > riemann.5555: Flags [.], ack 871, win 229, options [nop,nop,TS val 320213421 ecr 1751886010], length 0
10:40:40.241518 IP collectd.51434 > riemann.5555: Flags [P.], seq 44717:44928, ack 871, win 229, options [nop,nop,TS val 320213421 ecr 1751886010], length 211
10:40:40.265301 IP riemann.5555 > collectd.51434: Flags [P.], seq 871:877, ack 44928, win 1452, options [nop,nop,TS val 1751886016 ecr 320213421], length 6
10:40:40.265434 IP collectd.51434 > riemann.5555: Flags [P.], seq 44928:45139, ack 877, win 229, options [nop,nop,TS val 320213427 ecr 1751886016], length 211
10:40:40.284987 IP riemann.5555 > collectd.51434: Flags [P.], seq 877:883, ack 45139, win 1452, options [nop,nop,TS val 1751886021 ecr 320213427], length 6
10:40:40.285136 IP collectd.51434 > riemann.5555: Flags [P.], seq 45139:45350, ack 883, win 229, options [nop,nop,TS val 320213432 ecr 1751886021], length 211
10:40:40.304118 IP riemann.5555 > collectd.51434: Flags [P.], seq 883:889, ack 45350, win 1452, options [nop,nop,TS val 1751886026 ecr 320213432], length 6
10:40:40.304278 IP collectd.51434 > riemann.5555: Flags [P.], seq 45350:45557, ack 889, win 229, options [nop,nop,TS val 320213437 ecr 1751886026], length 207
10:40:40.322970 IP riemann.5555 > collectd.51434: Flags [P.], seq 889:895, ack 45557, win 1452, options [nop,nop,TS val 1751886031 ecr 320213437], length 6
10:40:40.323119 IP collectd.51434 > riemann.5555: Flags [P.], seq 45557:45764, ack 895, win 229, options [nop,nop,TS val 320213441 ecr 1751886031], length 207
10:40:40.341572 IP riemann.5555 > collectd.51434: Flags [P.], seq 895:901, ack 45764, win 1452, options [nop,nop,TS val 1751886036 ecr 320213441], length 6
10:40:40.341701 IP collectd.51434 > riemann.5555: Flags [P.], seq 45764:45971, ack 901, win 229, options [nop,nop,TS val 320213446 ecr 1751886036], length 207
10:40:40.360897 IP riemann.5555 > collectd.51434: Flags [P.], seq 901:907, ack 45971, win 1452, options [nop,nop,TS val 1751886040 ecr 320213446], length 6
10:40:40.360995 IP collectd.51434 > riemann.5555: Flags [P.], seq 45971:46178, ack 907, win 229, options [nop,nop,TS val 320213451 ecr 1751886040], length 207
10:40:40.379007 IP riemann.5555 > collectd.51434: Flags [P.], seq 907:913, ack 46178, win 1452, options [nop,nop,TS val 1751886045 ecr 320213451], length 6
10:40:40.379109 IP collectd.51434 > riemann.5555: Flags [P.], seq 46178:46385, ack 913, win 229, options [nop,nop,TS val 320213455 ecr 1751886045], length 207
10:40:40.401293 IP riemann.5555 > collectd.51434: Flags [P.], seq 913:919, ack 46385, win 1452, options [nop,nop,TS val 1751886050 ecr 320213455], length 6
10:40:40.401472 IP collectd.51434 > riemann.5555: Flags [P.], seq 46385:46592, ack 919, win 229, options [nop,nop,TS val 320213461 ecr 1751886050], length 207
10:40:40.421435 IP riemann.5555 > collectd.51434: Flags [P.], seq 919:925, ack 46592, win 1452, options [nop,nop,TS val 1751886055 ecr 320213461], length 6
10:40:40.421553 IP collectd.51434 > riemann.5555: Flags [P.], seq 46592:46803, ack 925, win 229, options [nop,nop,TS val 320213466 ecr 1751886055], length 211
10:40:40.441204 IP riemann.5555 > collectd.51434: Flags [P.], seq 925:931, ack 46803, win 1452, options [nop,nop,TS val 1751886060 ecr 320213466], length 6
10:40:40.441373 IP collectd.51434 > riemann.5555: Flags [P.], seq 46803:47010, ack 931, win 229, options [nop,nop,TS val 320213471 ecr 1751886060], length 207
10:40:40.461538 IP riemann.5555 > collectd.51434: Flags [P.], seq 931:937, ack 47010, win 1452, options [nop,nop,TS val 1751886065 ecr 320213471], length 6
10:40:40.461700 IP collectd.51434 > riemann.5555: Flags [P.], seq 47010:47227, ack 937, win 229, options [nop,nop,TS val 320213476 ecr 1751886065], length 217
10:40:40.481074 IP riemann.5555 > collectd.51434: Flags [P.], seq 937:943, ack 47227, win 1452, options [nop,nop,TS val 1751886070 ecr 320213476], length 6
10:40:40.481215 IP collectd.51434 > riemann.5555: Flags [P.], seq 47227:47434, ack 943, win 229, options [nop,nop,TS val 320213481 ecr 1751886070], length 207
10:40:40.501007 IP riemann.5555 > collectd.51434: Flags [P.], seq 943:949, ack 47434, win 1452, options [nop,nop,TS val 1751886075 ecr 320213481], length 6
10:40:40.501152 IP collectd.51434 > riemann.5555: Flags [P.], seq 47434:47651, ack 949, win 229, options [nop,nop,TS val 320213486 ecr 1751886075], length 217
10:40:40.518903 IP riemann.5555 > collectd.51434: Flags [P.], seq 949:955, ack 47651, win 1452, options [nop,nop,TS val 1751886080 ecr 320213486], length 6
10:40:40.519052 IP collectd.51434 > riemann.5555: Flags [P.], seq 47651:47868, ack 955, win 229, options [nop,nop,TS val 320213490 ecr 1751886080], length 217
10:40:40.537048 IP riemann.5555 > collectd.51434: Flags [P.], seq 955:961, ack 47868, win 1452, options [nop,nop,TS val 1751886084 ecr 320213490], length 6
10:40:40.537202 IP collectd.51434 > riemann.5555: Flags [P.], seq 47868:48081, ack 961, win 229, options [nop,nop,TS val 320213495 ecr 1751886084], length 213
10:40:40.555409 IP riemann.5555 > collectd.51434: Flags [P.], seq 961:967, ack 48081, win 1452, options [nop,nop,TS val 1751886089 ecr 320213495], length 6
10:40:40.555592 IP collectd.51434 > riemann.5555: Flags [P.], seq 48081:48294, ack 967, win 229, options [nop,nop,TS val 320213500 ecr 1751886089], length 213
10:40:40.574998 IP riemann.5555 > collectd.51434: Flags [P.], seq 967:973, ack 48294, win 1452, options [nop,nop,TS val 1751886094 ecr 320213500], length 6
10:40:40.575157 IP collectd.51434 > riemann.5555: Flags [P.], seq 48294:48501, ack 973, win 229, options [nop,nop,TS val 320213504 ecr 1751886094], length 207
10:40:40.593067 IP riemann.5555 > collectd.51434: Flags [P.], seq 973:979, ack 48501, win 1452, options [nop,nop,TS val 1751886098 ecr 320213504], length 6
10:40:40.593188 IP collectd.51434 > riemann.5555: Flags [P.], seq 48501:48708, ack 979, win 229, options [nop,nop,TS val 320213509 ecr 1751886098], length 207
10:40:40.615632 IP riemann.5555 > collectd.51434: Flags [P.], seq 979:985, ack 48708, win 1452, options [nop,nop,TS val 1751886104 ecr 320213509], length 6
10:40:40.615730 IP collectd.51434 > riemann.5555: Flags [P.], seq 48708:48915, ack 985, win 229, options [nop,nop,TS val 320213515 ecr 1751886104], length 207
10:40:40.635184 IP riemann.5555 > collectd.51434: Flags [P.], seq 985:991, ack 48915, win 1452, options [nop,nop,TS val 1751886109 ecr 320213515], length 6
10:40:40.635382 IP collectd.51434 > riemann.5555: Flags [P.], seq 48915:49124, ack 991, win 229, options [nop,nop,TS val 320213520 ecr 1751886109], length 209
10:40:40.655102 IP riemann.5555 > collectd.51434: Flags [P.], seq 991:997, ack 49124, win 1452, options [nop,nop,TS val 1751886114 ecr 320213520], length 6
10:40:40.655205 IP collectd.51434 > riemann.5555: Flags [P.], seq 49124:49337, ack 997, win 229, options [nop,nop,TS val 320213524 ecr 1751886114], length 213
10:40:40.673160 IP riemann.5555 > collectd.51434: Flags [P.], seq 997:1003, ack 49337, win 1452, options [nop,nop,TS val 1751886118 ecr 320213524], length 6
10:40:40.673255 IP collectd.51434 > riemann.5555: Flags [P.], seq 49337:49550, ack 1003, win 229, options [nop,nop,TS val 320213529 ecr 1751886118], length 213
10:40:40.691064 IP riemann.5555 > collectd.51434: Flags [P.], seq 1003:1009, ack 49550, win 1452, options [nop,nop,TS val 1751886123 ecr 320213529], length 6
10:40:40.691171 IP collectd.51434 > riemann.5555: Flags [P.], seq 49550:49759, ack 1009, win 229, options [nop,nop,TS val 320213533 ecr 1751886123], length 209
10:40:40.708985 IP riemann.5555 > collectd.51434: Flags [P.], seq 1009:1015, ack 49759, win 1452, options [nop,nop,TS val 1751886127 ecr 320213533], length 6
10:40:40.709112 IP collectd.51434 > riemann.5555: Flags [P.], seq 49759:49966, ack 1015, win 229, options [nop,nop,TS val 320213538 ecr 1751886127], length 207
10:40:40.727057 IP riemann.5555 > collectd.51434: Flags [P.], seq 1015:1021, ack 49966, win 1452, options [nop,nop,TS val 1751886132 ecr 320213538], length 6
10:40:40.727162 IP collectd.51434 > riemann.5555: Flags [P.], seq 49966:50175, ack 1021, win 229, options [nop,nop,TS val 320213542 ecr 1751886132], length 209
10:40:40.745028 IP riemann.5555 > collectd.51434: Flags [P.], seq 1021:1027, ack 50175, win 1452, options [nop,nop,TS val 1751886136 ecr 320213542], length 6
10:40:40.745164 IP collectd.51434 > riemann.5555: Flags [P.], seq 50175:50382, ack 1027, win 229, options [nop,nop,TS val 320213547 ecr 1751886136], length 207
10:40:40.765468 IP riemann.5555 > collectd.51434: Flags [P.], seq 1027:1033, ack 50382, win 1452, options [nop,nop,TS val 1751886141 ecr 320213547], length 6
10:40:40.765613 IP collectd.51434 > riemann.5555: Flags [P.], seq 50382:50812, ack 1033, win 229, options [nop,nop,TS val 320213552 ecr 1751886141], length 430
10:40:40.785225 IP riemann.5555 > collectd.51434: Flags [P.], seq 1033:1039, ack 50812, win 1452, options [nop,nop,TS val 1751886146 ecr 320213552], length 6
10:40:40.785400 IP collectd.51434 > riemann.5555: Flags [P.], seq 50812:51246, ack 1039, win 229, options [nop,nop,TS val 320213557 ecr 1751886146], length 434
10:40:40.805528 IP riemann.5555 > collectd.51434: Flags [P.], seq 1039:1045, ack 51246, win 1452, options [nop,nop,TS val 1751886152 ecr 320213557], length 6
10:40:40.805688 IP collectd.51434 > riemann.5555: Flags [P.], seq 51246:51676, ack 1045, win 229, options [nop,nop,TS val 320213562 ecr 1751886152], length 430
10:40:40.825772 IP riemann.5555 > collectd.51434: Flags [P.], seq 1045:1051, ack 51676, win 1452, options [nop,nop,TS val 1751886157 ecr 320213562], length 6
10:40:40.825877 IP collectd.51434 > riemann.5555: Flags [P.], seq 51676:52090, ack 1051, win 229, options [nop,nop,TS val 320213567 ecr 1751886157], length 414
10:40:40.845165 IP riemann.5555 > collectd.51434: Flags [P.], seq 1051:1057, ack 52090, win 1452, options [nop,nop,TS val 1751886161 ecr 320213567], length 6
10:40:40.845346 IP collectd.51434 > riemann.5555: Flags [P.], seq 52090:52297, ack 1057, win 229, options [nop,nop,TS val 320213572 ecr 1751886161], length 207
10:40:40.862995 IP riemann.5555 > collectd.51434: Flags [P.], seq 1057:1063, ack 52297, win 1452, options [nop,nop,TS val 1751886166 ecr 320213572], length 6
10:40:40.863104 IP collectd.51434 > riemann.5555: Flags [P.], seq 52297:52514, ack 1063, win 229, options [nop,nop,TS val 320213576 ecr 1751886166], length 217
10:40:40.881021 IP riemann.5555 > collectd.51434: Flags [P.], seq 1063:1069, ack 52514, win 1452, options [nop,nop,TS val 1751886170 ecr 320213576], length 6
10:40:40.881195 IP collectd.51434 > riemann.5555: Flags [P.], seq 52514:52932, ack 1069, win 229, options [nop,nop,TS val 320213581 ecr 1751886170], length 418
10:40:40.899501 IP riemann.5555 > collectd.51434: Flags [P.], seq 1069:1075, ack 52932, win 1452, options [nop,nop,TS val 1751886175 ecr 320213581], length 6
10:40:40.899605 IP collectd.51434 > riemann.5555: Flags [P.], seq 52932:53141, ack 1075, win 229, options [nop,nop,TS val 320213586 ecr 1751886175], length 209
10:40:40.919843 IP riemann.5555 > collectd.51434: Flags [P.], seq 1075:1081, ack 53141, win 1452, options [nop,nop,TS val 1751886180 ecr 320213586], length 6
10:40:40.919993 IP collectd.51434 > riemann.5555: Flags [P.], seq 53141:53559, ack 1081, win 229, options [nop,nop,TS val 320213591 ecr 1751886180], length 418
10:40:40.941779 IP riemann.5555 > collectd.51434: Flags [P.], seq 1081:1087, ack 53559, win 1452, options [nop,nop,TS val 1751886186 ecr 320213591], length 6
10:40:40.941935 IP collectd.51434 > riemann.5555: Flags [P.], seq 53559:53973, ack 1087, win 229, options [nop,nop,TS val 320213596 ecr 1751886186], length 414
10:40:40.961186 IP riemann.5555 > collectd.51434: Flags [P.], seq 1087:1093, ack 53973, win 1452, options [nop,nop,TS val 1751886190 ecr 320213596], length 6
10:40:40.961364 IP collectd.51434 > riemann.5555: Flags [P.], seq 53973:54180, ack 1093, win 229, options [nop,nop,TS val 320213601 ecr 1751886190], length 207
10:40:40.979101 IP riemann.5555 > collectd.51434: Flags [P.], seq 1093:1099, ack 54180, win 1452, options [nop,nop,TS val 1751886195 ecr 320213601], length 6
10:40:40.979280 IP collectd.51434 > riemann.5555: Flags [P.], seq 54180:54594, ack 1099, win 229, options [nop,nop,TS val 320213606 ecr 1751886195], length 414
10:40:41.001653 IP riemann.5555 > collectd.51434: Flags [P.], seq 1099:1105, ack 54594, win 1452, options [nop,nop,TS val 1751886201 ecr 320213606], length 6
10:40:41.001819 IP collectd.51434 > riemann.5555: Flags [P.], seq 54594:55012, ack 1105, win 229, options [nop,nop,TS val 320213611 ecr 1751886201], length 418
10:40:41.021420 IP riemann.5555 > collectd.51434: Flags [P.], seq 1105:1111, ack 55012, win 1452, options [nop,nop,TS val 1751886205 ecr 320213611], length 6
10:40:41.021566 IP collectd.51434 > riemann.5555: Flags [P.], seq 55012:55426, ack 1111, win 229, options [nop,nop,TS val 320213616 ecr 1751886205], length 414
10:40:41.041203 IP riemann.5555 > collectd.51434: Flags [P.], seq 1111:1117, ack 55426, win 1452, options [nop,nop,TS val 1751886210 ecr 320213616], length 6
10:40:41.041356 IP collectd.51434 > riemann.5555: Flags [P.], seq 55426:55844, ack 1117, win 229, options [nop,nop,TS val 320213621 ecr 1751886210], length 418
10:40:41.061273 IP riemann.5555 > collectd.51434: Flags [P.], seq 1117:1123, ack 55844, win 1452, options [nop,nop,TS val 1751886215 ecr 320213621], length 6
10:40:41.061429 IP collectd.51434 > riemann.5555: Flags [P.], seq 55844:56266, ack 1123, win 229, options [nop,nop,TS val 320213626 ecr 1751886215], length 422
10:40:41.081437 IP riemann.5555 > collectd.51434: Flags [P.], seq 1123:1129, ack 56266, win 1452, options [nop,nop,TS val 1751886220 ecr 320213626], length 6
10:40:41.081546 IP collectd.51434 > riemann.5555: Flags [P.], seq 56266:56684, ack 1129, win 229, options [nop,nop,TS val 320213631 ecr 1751886220], length 418
10:40:41.101154 IP riemann.5555 > collectd.51434: Flags [P.], seq 1129:1135, ack 56684, win 1452, options [nop,nop,TS val 1751886225 ecr 320213631], length 6
10:40:41.101300 IP collectd.51434 > riemann.5555: Flags [P.], seq 56684:57110, ack 1135, win 229, options [nop,nop,TS val 320213636 ecr 1751886225], length 426
10:40:41.121505 IP riemann.5555 > collectd.51434: Flags [P.], seq 1135:1141, ack 57110, win 1452, options [nop,nop,TS val 1751886230 ecr 320213636], length 6
10:40:41.121634 IP collectd.51434 > riemann.5555: Flags [P.], seq 57110:57528, ack 1141, win 229, options [nop,nop,TS val 320213641 ecr 1751886230], length 418
10:40:41.141196 IP riemann.5555 > collectd.51434: Flags [P.], seq 1141:1147, ack 57528, win 1452, options [nop,nop,TS val 1751886235 ecr 320213641], length 6
10:40:41.141301 IP collectd.51434 > riemann.5555: Flags [P.], seq 57528:57954, ack 1147, win 229, options [nop,nop,TS val 320213646 ecr 1751886235], length 426
10:40:41.159192 IP riemann.5555 > collectd.51434: Flags [P.], seq 1147:1153, ack 57954, win 1452, options [nop,nop,TS val 1751886240 ecr 320213646], length 6
10:40:41.159324 IP collectd.51434 > riemann.5555: Flags [P.], seq 57954:58384, ack 1153, win 229, options [nop,nop,TS val 320213651 ecr 1751886240], length 430
10:40:41.177158 IP riemann.5555 > collectd.51434: Flags [P.], seq 1153:1159, ack 58384, win 1452, options [nop,nop,TS val 1751886244 ecr 320213651], length 6
10:40:41.177259 IP collectd.51434 > riemann.5555: Flags [P.], seq 58384:58806, ack 1159, win 229, options [nop,nop,TS val 320213655 ecr 1751886244], length 422
10:40:41.196085 IP riemann.5555 > collectd.51434: Flags [P.], seq 1159:1165, ack 58806, win 1452, options [nop,nop,TS val 1751886249 ecr 320213655], length 6
10:40:41.196189 IP collectd.51434 > riemann.5555: Flags [P.], seq 58806:59220, ack 1165, win 229, options [nop,nop,TS val 320213660 ecr 1751886249], length 414
10:40:41.215163 IP riemann.5555 > collectd.51434: Flags [P.], seq 1165:1171, ack 59220, win 1452, options [nop,nop,TS val 1751886254 ecr 320213660], length 6
10:40:41.215272 IP collectd.51434 > riemann.5555: Flags [P.], seq 59220:59638, ack 1171, win 229, options [nop,nop,TS val 320213664 ecr 1751886254], length 418
10:40:41.233154 IP riemann.5555 > collectd.51434: Flags [P.], seq 1171:1177, ack 59638, win 1452, options [nop,nop,TS val 1751886258 ecr 320213664], length 6
10:40:41.233257 IP collectd.51434 > riemann.5555: Flags [P.], seq 59638:60052, ack 1177, win 229, options [nop,nop,TS val 320213669 ecr 1751886258], length 414
10:40:41.251327 IP riemann.5555 > collectd.51434: Flags [P.], seq 1177:1183, ack 60052, win 1452, options [nop,nop,TS val 1751886263 ecr 320213669], length 6
10:40:41.251450 IP collectd.51434 > riemann.5555: Flags [P.], seq 60052:60458, ack 1183, win 229, options [nop,nop,TS val 320213674 ecr 1751886263], length 406
10:40:41.271163 IP riemann.5555 > collectd.51434: Flags [P.], seq 1183:1189, ack 60458, win 1452, options [nop,nop,TS val 1751886268 ecr 320213674], length 6
10:40:41.271268 IP collectd.51434 > riemann.5555: Flags [P.], seq 60458:60868, ack 1189, win 229, options [nop,nop,TS val 320213678 ecr 1751886268], length 410
10:40:41.289134 IP riemann.5555 > collectd.51434: Flags [P.], seq 1189:1195, ack 60868, win 1452, options [nop,nop,TS val 1751886272 ecr 320213678], length 6
10:40:41.289238 IP collectd.51434 > riemann.5555: Flags [P.], seq 60868:61274, ack 1195, win 229, options [nop,nop,TS val 320213683 ecr 1751886272], length 406
10:40:41.307171 IP riemann.5555 > collectd.51434: Flags [P.], seq 1195:1201, ack 61274, win 1452, options [nop,nop,TS val 1751886277 ecr 320213683], length 6
10:40:41.307332 IP collectd.51434 > riemann.5555: Flags [P.], seq 61274:61708, ack 1201, win 229, options [nop,nop,TS val 320213688 ecr 1751886277], length 434
10:40:41.325166 IP riemann.5555 > collectd.51434: Flags [P.], seq 1201:1207, ack 61708, win 1452, options [nop,nop,TS val 1751886281 ecr 320213688], length 6
10:40:41.325263 IP collectd.51434 > riemann.5555: Flags [P.], seq 61708:62126, ack 1207, win 229, options [nop,nop,TS val 320213692 ecr 1751886281], length 418
10:40:41.343276 IP riemann.5555 > collectd.51434: Flags [P.], seq 1207:1213, ack 62126, win 1452, options [nop,nop,TS val 1751886286 ecr 320213692], length 6
10:40:41.343433 IP collectd.51434 > riemann.5555: Flags [P.], seq 62126:62556, ack 1213, win 229, options [nop,nop,TS val 320213697 ecr 1751886286], length 430
10:40:41.363093 IP riemann.5555 > collectd.51434: Flags [P.], seq 1213:1219, ack 62556, win 1452, options [nop,nop,TS val 1751886291 ecr 320213697], length 6
10:40:41.363220 IP collectd.51434 > riemann.5555: Flags [P.], seq 62556:62990, ack 1219, win 229, options [nop,nop,TS val 320213701 ecr 1751886291], length 434
10:40:41.381426 IP riemann.5555 > collectd.51434: Flags [P.], seq 1219:1225, ack 62990, win 1452, options [nop,nop,TS val 1751886295 ecr 320213701], length 6
10:40:41.381545 IP collectd.51434 > riemann.5555: Flags [P.], seq 62990:63404, ack 1225, win 229, options [nop,nop,TS val 320213706 ecr 1751886295], length 414
10:40:41.401419 IP riemann.5555 > collectd.51434: Flags [P.], seq 1225:1231, ack 63404, win 1452, options [nop,nop,TS val 1751886300 ecr 320213706], length 6
10:40:41.401529 IP collectd.51434 > riemann.5555: Flags [P.], seq 63404:63834, ack 1231, win 229, options [nop,nop,TS val 320213711 ecr 1751886300], length 430
10:40:41.421282 IP riemann.5555 > collectd.51434: Flags [P.], seq 1231:1237, ack 63834, win 1452, options [nop,nop,TS val 1751886305 ecr 320213711], length 6
```

So basically, by reducing the number of TCP packets collectd sends to riemann, you reduce the number of acknowledgements riemann has to sends back to collectd.

This isn't much of an issue if you have a handful of collectd nodes, but makes a big difference when riemann has to handle events submitted by dozens of them.

**Comment by blalor** [comment]
Ah, so it's the ack.  That makes sense.  I figured the ack was on a per-event basis (which makes no sense, I know!).

**Comment by pyr** [comment]
I agree with switching to TCP and batching by default, even though we might have to deal with a few more questions since events don't come in at once.

Cheers

**Comment by mfournier** [comment]
@pyr so if I read you correctly, you'd favor amending the doc to warn about delayed events rather than increasing the default `TTLFactor` ? I'm also fine with this.

**Comment by faxm0dem** [comment]
My two bitcoins here: If there were an option to automatically send events (selected, or whole payload) when there is a configurable time limit above which the time to expiration should not be reached, it would solve the "events don't come in at once" issue.

**Comment by pyr** [comment]
@faxm0dem yes, this is planned as well :-)

**Comment by blalor** [comment]
What's the batch size/period going to be?  Would it be longer than the collection period?

**Comment by mfournier** [comment]
@blalor, the default batch size is 9kB. How frequently they will be flushed really depends on how many metrics are read, how frequently, and how much metadata (tags, attributes, ...) is added to the events. It can be several batches per interval as well as one batch every few intervals.

**Comment by blalor** [comment]
I'm playing around with this patch on the collectd-5.4 branch (just copied write_graphite.c from master).  I definitely see a performance improvement vs no batching, so that's impressive.  I'm concerned about the lack of a periodic flush, however.  I feel like values should be flushed every `Interval` seconds, regardless of the batch size.  I'm surprised this isn't in the collectd core.  The problem with the current solution is that values can sit in memory in collectd for so long that they're expired by the time they get to Riemann.  Tuning the batch size will help, but that's still sort of shooting in the dark.

**Comment by faxm0dem** [comment]
:+1:

**Comment by mfournier** [comment]
So to recap:

- we had an issue which people sending lots of events to riemann suffered from. Users regularly complained about this on #riemann. Batching solves this problem.
- because it was a hard to diagnose problem, we decided to make batching the default in 5.5
- the current batching implementation can lead to timing issues for people sending very few events to riemann
- @pyr plans to fix this problem, but unlikely in time for the 5.5 release
- this annoyance is documented in the manpage

Given this, I still believe making batching the default is the right decision. If you think this is wrong, let's discuss that further ;-)

**Comment by blalor** [comment]
I don't think it was a wrong decision.  I've seen what happens when sending a thousand events/sec with an ack per.  I'm actually going to implement something similar for https://github.com/amir/raidman/!  :-

I didn't realize the timing issue had been raised previously.  I think the lack of periodic flush is actually a core collectd problem, not necessarily something each plugin should have to deal with.
