### ISSUE TITLE
write_graphite fails after carbon-cache.py is restarted

### ISSUE THREAD

**Issue by rtkmhart** [collectd/collectd#430]
Using write_graphite with the following configuration: 

```
<Plugin write_graphite>
  <Node "graphite">
    Host "1.2.3.4"
    Port "2003"
    Protocol "tcp"
    LogSendErrors false
    Prefix "collectd."
    EscapeCharacter "_"
    StoreRates true
    SeparateInstances false
    AlwaysAppendDS false
  </Node>
</Plugin>
```

when carbon-cache.py is restarted, write_graphite has trouble recovering. When it behaves, the TCP connection remains open and a continuous stream of data is seen. When it starts misbehaving, it constantly opens a TCP connection, sends a few packets, and tears it down again, waits 10 seconds (my Interval setting) and starts again. 

The only workaround I can find is to restart collectd, which is unacceptable, or to use UDP, which is not a great solution in an unreliable network.

A sample tcpdump during this scenario, where 1.2.3.4 is the collectd host and 6.7.8.9 is the graphite host.

16:57:08.704241 IP 1.2.3.4.34411 > 6.7.8.9.2003: Flags [S], seq 3665591141, win 14600, options [mss 1460,sackOK,TS val 132755241 ecr 0,nop,wscale 4], length 0
16:57:08.708024 IP 6.7.8.9.2003 > 1.2.3.4.34411: Flags [S.], seq 352170176, ack 3665591142, win 14480, options [mss 1350,sackOK,TS val 586578018 ecr 132755241,nop,wscale 5], length 0
16:57:08.708067 IP 1.2.3.4.34411 > 6.7.8.9.2003: Flags [.], ack 1, win 913, options [nop,nop,TS val 132755242 ecr 586578018], length 0
16:57:08.708307 IP 1.2.3.4.34411 > 6.7.8.9.2003: Flags [.], seq 1:1339, ack 1, win 913, options [nop,nop,TS val 132755242 ecr 586578018], length 1338
16:57:08.708315 IP 1.2.3.4.34411 > 6.7.8.9.2003: Flags [.], seq 1339:2677, ack 1, win 913, options [nop,nop,TS val 132755242 ecr 586578018], length 1338
16:57:08.708322 IP 1.2.3.4.34411 > 6.7.8.9.2003: Flags [P.], seq 2677:3472, ack 1, win 913, options [nop,nop,TS val 132755242 ecr 586578018], length 795
16:57:08.708380 IP 1.2.3.4.34411 > 6.7.8.9.2003: Flags [F.], seq 3472, ack 1, win 913, options [nop,nop,TS val 132755242 ecr 586578018], length 0
16:57:08.712475 IP 6.7.8.9.2003 > 1.2.3.4.34411: Flags [.], ack 1339, win 543, options [nop,nop,TS val 586578019 ecr 132755242], length 0
16:57:08.712501 IP 6.7.8.9.2003 > 1.2.3.4.34411: Flags [.], ack 2677, win 634, options [nop,nop,TS val 586578019 ecr 132755242], length 0
16:57:08.712520 IP 6.7.8.9.2003 > 1.2.3.4.34411: Flags [.], ack 3472, win 718, options [nop,nop,TS val 586578019 ecr 132755242], length 0
16:57:08.714042 IP 6.7.8.9.2003 > 1.2.3.4.34411: Flags [F.], seq 1, ack 3473, win 718, options [nop,nop,TS val 586578019 ecr 132755242], length 0
16:57:08.714061 IP 1.2.3.4.34411 > 6.7.8.9.2003: Flags [.], ack 2, win 913, options [nop,nop,TS val 132755243 ecr 586578019], length 0
16:57:18.715748 IP 1.2.3.4.34412 > 6.7.8.9.2003: Flags [S], seq 3893987747, win 14600, options [mss 1460,sackOK,TS val 132757744 ecr 0,nop,wscale 4], length 0
16:57:18.806629 IP 6.7.8.9.2003 > 1.2.3.4.34412: Flags [S.], seq 2022196734, ack 3893987748, win 14480, options [mss 1350,sackOK,TS val 586580535 ecr 132757744,nop,wscale 5], length 0
